{
  "analysis_status": "diagnosed",
  "summary": "앱이 DATABASE_URL을 읽지 못해 시작에 실패했습니다. 설정 등록 여부와 실행 환경으로의 전달 여부를 확인해야 합니다.",
  "observations": [
    {
      "id": "O1",
      "kind": "failure",
      "text": "필수 설정 DATABASE_URL을 찾지 못했다는 오류와 앱 시작 실패가 기록됐습니다.",
      "evidence_ids": [
        "EV000001",
        "EV000002"
      ]
    }
  ],
  "hypotheses": [
    {
      "id": "H1",
      "category": "configuration",
      "support_level": "direct",
      "statement": "앱 시작 시점에 필수 설정 DATABASE_URL을 확보하지 못했습니다.",
      "observation_ids": [
        "O1"
      ],
      "evidence_ids": [
        "EV000001",
        "EV000002"
      ],
      "counter_evidence_ids": [],
      "uncertainty": "설정 미등록, 전달 실패, 앱의 설정 로딩 문제는 현재 로그만으로 구분할 수 없습니다."
    }
  ],
  "next_checks": [
    {
      "id": "C1",
      "target": "실행 환경의 DATABASE_URL 설정",
      "method": "설정 이름과 등록 여부, 앱 실행 단계로의 전달 여부를 확인합니다. 비밀값 자체는 공유하지 않습니다.",
      "purpose": "설정 누락과 전달·로딩 문제를 구분합니다.",
      "hypothesis_ids": [
        "H1"
      ]
    }
  ],
  "missing_information": [
    {
      "requested_data": "DATABASE_URL의 등록 여부와 전달 단계. 값은 제외합니다.",
      "reason": "필수 설정을 확보하지 못한 구체적인 원인을 구분하기 위해 필요합니다."
    }
  ],
  "limitations": [
    "입력은 앱 시작 로그이며 실제 배포 설정은 확인하지 않았습니다."
  ],
  "remediation": {
    "status": "proposed",
    "reason": "필수 설정 누락 근거가 있어 등록·전달 문제를 확인한 뒤 적용할 설정 변경안을 제시합니다.",
    "plans": [
      {
        "id": "R1",
        "title": "실행 환경에 DATABASE_URL 등록 및 전달",
        "hypothesis_ids": [
          "H1"
        ],
        "evidence_ids": [
          "EV000001",
          "EV000002"
        ],
        "apply_when": [
          "대상 배포의 DATABASE_URL이 없거나 실행 프로세스로 전달되지 않는 것을 확인한 경우",
          "기존 설정과 적용 대상을 확인하고 팀의 비밀값 관리 위치를 사용합니다."
        ],
        "changes": [
          {
            "kind": "configuration",
            "target": "DATABASE_URL",
            "target_known": true,
            "instruction": "사용 중인 배포 설정의 환경변수 항목에 DATABASE_URL을 등록하고 시작 프로세스로 전달합니다. dotenv 형식은 환경이 해당 형식을 지원할 때 사용하는 예시입니다.",
            "language": "dotenv",
            "snippet_kind": "template",
            "snippet": "DATABASE_URL={{DATABASE_URL}}",
            "placeholders": [
              {
                "name": "DATABASE_URL",
                "description": "팀의 비밀값 저장소에서 가져올 실제 연결 문자열. 결과나 로그에 값을 출력하지 않습니다."
              }
            ]
          }
        ],
        "verification": [
          {
            "instruction": "설정값을 출력하지 않고 대상 실행 프로세스에서 DATABASE_URL의 존재 여부를 확인한 뒤 동일 시작 절차를 다시 수행합니다.",
            "expected_result": "필수 설정 누락 오류가 사라지고 애플리케이션 시작과 상태 점검이 정상 완료됩니다."
          }
        ],
        "rollback": [
          "새 설정으로 다른 문제가 발생하면 변경 전 환경변수 설정과 배포 버전으로 되돌립니다."
        ],
        "risks": [
          "올바르지 않은 DB 대상으로 연결하지 않도록 환경을 확인합니다. 설정 반영에 재시작이 필요할 수 있습니다."
        ]
      }
    ]
  }
}
